Title,Link,Image,Source,Date,Article content
UK human rights group launches campaign to stop Shein's potential London IPO,https://www.cnbc.com/2024/06/27/uk-human-rights-group-launches-campaign-to-stop-sheins-potential-london-ipo.html,https://image.cnbcfm.com/api/v1/image/107432238-1719236945716-gettyimages-2150177788-20090101240429-99-852802.jpeg?v=1719457162&w=884&h=442&vtcrop=y,2 days ago - CNBC News,2024-06-26,"UK-based human rights group Stop Uyghur Genocide has launched a legal campaign to block Shein's potential London listing over concerns about its labor practices, a law firm representing the campaign group said on Wednesday.
Human rights law firm Leigh Day has written to the UK's Financial Conduct Authority to urge the regulator to refuse any attempt by Shein to list on the LSE, it said.
Shein did not immediately respond to a Reuters request for comment, while the FCA declined to comment.
On Tuesday, Amnesty International UK said Shein's potential London initial public offering would be a ""badge of shame"" for the London Stock Exchange because of the fast-fashion firm's ""questionable"" labor and human rights standards.
Shein confidentially filed papers with Britain's markets regulator in June, two sources told Reuters on Monday, kicking off the process for a potential London listing later this year.
The company has previously said it was investing in strengthening governance and compliance across its supply chain.
The FCA has no investigation or enforcement powers relating to alleged breaches of legislation not within its remit, such as the Modern Slavery Act or tax legislation."
Webtoon Entertainment prices U.S. IPO at top of range to raise about $315 million,https://www.cnbc.com/2024/06/27/webtoon-entertainment-prices-us-ipo-at-top-range-to-raise-315-million.html,https://image.cnbcfm.com/api/v1/image/107291275-1692861074782-gettyimages-1619655900-SKOREA_NAVER_AI.jpeg?v=1719452652&w=412&h=442&vtcrop=y,2 days ago - CNBC News,2024-06-26,"In this article
Webtoon Entertainment has priced its initial public offering (IPO) at the top of its indicated range, seeking to raise about $315 million, the online comics platform said on Wednesday.
The company, majority-owned by South Korean tech giant Naver, priced its 15 million shares at $21 apiece, and had marketed the range of $18 to $21.
The IPO now values the Los Angeles, California-based company at $2.67 billion.
Goldman Sachs, Morgan Stanley, J.P. Morgan Securities and Evercore Group are the lead underwriters for the IPO.
Webtoon was founded in 2005 as a side project of CEO Junkoo Kim while he was working as a search engineer at Naver.
The company, whose roots are in Korea, is a storytelling platform that is home to thousands of titles across multiple genres including fantasy, action, romance, and horror.
Webtoon has about 170 million monthly active users in more than 150 countries around the world.
The company's offerings include Japanese web-comic and manga app Line Manga, web-novel platform Wattpad and Korean web-comic offering Naver Webtoon.
Certain funds and accounts managed by world's largest asset manager BlackRock had indicated an interest in buying up to $50 million worth of shares sold in the offering.
Separately, Naver's U.S. subsidiary Naver U.Hub had agreed to buy $50 million worth of shares of Webtoon in a concurrent private placement.
Webtoon's shares are expected to begin trading on the Nasdaq Global Select Market on June 27 under the symbol ""WBTN."""
"IPO market is coming back in Europe — but not in tech, UBS says",https://www.cnbc.com/video/2024/06/26/ipo-market-is-coming-back-in-europe-a-but-not-in-tech-ubs-says.html,https://image.cnbcfm.com/api/v1/image/107433569-17194138081719413804-35121859765-1080pnbcnews.jpg?v=1719413807&w=412&h=206&vtcrop=y,2 days ago - CNBC News,2024-06-26,Video content - No article body
Shein confidentially files for London IPO as U.S. listing stalls,https://www.cnbc.com/2024/06/24/shein-files-for-london-ipo.html,https://image.cnbcfm.com/api/v1/image/107413924-1715606370233-gettyimages-2150274388-europapress_5918123_shein_sign_during_its_opening_at_abc_ser.jpeg?v=1719237369&w=412&h=206&vtcrop=y,4 days ago - CNBC News,2024-06-24,"Shein, the fast fashion giant with links to China, has confidentially filed for a public listing in London as it faces backlash in the U.S., a person familiar with the matter told CNBC.
The person was granted anonymity in order to speak freely about the discussions, which are private.
The company had confidentially filed for a U.S. initial public offering in November but began looking toward London after it failed to win the support of American lawmakers.
Elected officials in the U.S. have repeatedly expressed concerns about the use of forced labor in Shein's supply chain and its use of a U.S. tax law exemption known as de minimis. Under the provision, packages valued at less than $800 are not charged import duties and aren't subject to the same levels of oversight from U.S. customs, which is tasked with screening packages to ensure items from banned regions don't come into the country.
Shein would still prefer to go public in the U.S., people familiar with the matter previously told CNBC, and its filing in London doesn't mean that an IPO will happen there. Shein had previously sought China's approval to go public in the U.S. It's unclear if Beijing has signed off on the London listing.
Shein declined to comment to CNBC.
Reuters first reported that Shein had confidentially filed in London.
Shein, which was founded in China, has gone to great lengths to establish itself as a ""global"" company, moving its headquarters to Singapore in 2021. Still, the vast majority of its supply chain is still based in China, and the fact that it needed to seek Beijing's approval to go public in the U.S. means regulators there view it as a Chinese company — and could exert control over its operations and data.
Shein's London filing marks another twist in the company's so-far long road to a public markets debut. It crashed onto the U.S. fashion scene during the Covid-19 pandemic and won over consumers with its ability to quickly offer the latest styles at rock-bottom prices. It's been a thorn in the side of U.S.-based competitors, which have ceded market share to the digital upstart and struggled to match its speed.
As Shein's prominence in the U.S. grew, so did its ambitions to go public. It began waging a U.S. charm offensive as it sought to win the approval of lawmakers and the retail industry, but those efforts have not yet succeeded. Shein has applied for membership in the National Retail Federation, the industry's largest trade association, multiple times and has repeatedly been rejected, CNBC reported.
It's found itself caught in the crossfire of a tense geopolitical rivalry between the U.S. and Beijing. American lawmakers, concerned about the influence companies with Chinese links can have on the U.S. economy, ramped up their scrutiny of Shein after it filed to go public. Some elected officials at the federal and state level have called on the U.S. Securities and Exchange Commission to block the company's listing because they say it would violate a U.S. law that bans the import of products made from the Xinjiang region in China, where the government has faced accusations of genocide against the Uyghur ethnic group.
Shein has acknowledged to CNBC that raw materials from banned regions have been found in its supply chain, but previous tests show that it's done a better job, on average, of ridding such materials from its garments than the industry overall.
In May, The Wall Street Journal reported that Shein was considering a London IPO after the SEC told the retailer that its listing wouldn't be accepted unless it made its filing public — a request that experts told the Journal was unusual. Typically, companies file to go public confidentially so they can protect sensitive information surrounding their operations and financials as regulators review the filing.
Even so, Shein's executive chairman insisted that its ambitions to go public are about transparency, not about raising capital.
""Most companies seek to go public for liquidity reasons,"" Donald Tang told the Journal. ""We seek to go public to embrace scrutiny and public diligence.""
— CNBC's Sara Salinas contributed to this report."
Experts say Shein's U.S. IPO is all but dead,https://www.cnbc.com/2024/06/21/shein-us-ipo-is-dead-experts-say.html,https://image.cnbcfm.com/api/v1/image/107413923-1715606369703-gettyimages-2150178097-20090101240429-99-852616.jpeg?v=1715606470&w=412&h=206&vtcrop=y,1 week ago - CNBC News,2024-06-21,"China-founded e-commerce company Shein's hopes of going public in the United States are growing slimmer by the day, according to experts, as rising tensions between Beijing and the U.S. roil business and trade.
The company, last valued at $66 billion, confidentially filed to go public in the U.S. in November. Since then, it has faced resistance as it tries to join the American retail sphere, including through numerous rejected attempts to become a member of the National Retail Federation, the industry's largest trade association, CNBC previously reported.
The e-commerce upstart filed to go public while becoming a household name in the U.S. by offering low prices and a facility to offer new styles quickly. The company is poised to take major market share from U.S. retailers, particularly Gap, TJX Companies and Macy's, according to UBS data from last year, and continues to challenge Target, Walmart and Amazon.
But as political resistance to its U.S. IPO mounts, Shein is seemingly shifting gears, as it reportedly prepares to confidentially file for a £50 billion offering in London in the coming weeks. The company likely would have preferred to list in the U.S., because the offering could bring a higher valuation than in the U.K., said Angelo Bochanis, an IPO analyst at Renaissance Capital, which provides pre-IPO research and IPO-focused ETFs. 
But its path hasn't been easy, as federal and state officials call on the Securities and Exchange Commission to scrutinize or even block the initial public offering in the U.S.
""Scrutinizing companies with high-profiles and roots in China is very politically in-vogue right now in the United States,"" Bochanis said.
A London IPO could, in theory, be easier than a U.S. offering, according to Bochanis. With the British parliament dissolved and the London Stock Exchange ""desperate for big wins"" as it suffers an IPO drought, Shein could circumvent some of the hurdles that it might have otherwise faced, he said.
If Shein's London IPO succeeds, it is unlikely to keep pursuing a U.S. offering, said University of Florida finance professor Jay Ritter, who studies IPOs.
Not all China-linked companies are getting tangled in the webs of rising political tensions. Chinese electric vehicle company Zeekr went public in the U.S. last month. It became one of the first prominent Chinese companies to do so in the U.S. even as the Biden administration has increasingly cracked down on Chinese-made electric vehicles.
Shein is ""one of the few"" China-tied companies that have gained deep brand awareness with U.S. consumers, Bochanis said.
The size of the potential offering, and the long, high-profile process accompanying it, have helped to make Shein an attractive target for politicians from both parties who want to look tough on Beijing-linked companies.
Shein was founded in China and has since moved its headquarters to Singapore. But a good chunk of the company's supply chain is still based in the country.
In December, the House Committee on Energy and Commerce sent a letter to Shein seeking information about the company's user data collection and its relationship to the Chinese government, calling a potential link to Beijing a ""serious risk for e-commerce, consumer safety and people's data privacy and security.""
The panel sent a similar letter to TikTok, the popular social media platform owned by China-based parent ByteDance.
The Chinese Communist Party can by law request any Chinese-owned company to share information on its customers, according to George Washington University professor Susan Ariel Aaronson. While Shein is headquartered offshore, its manufacturing ties in China and reports that it sought Beijing's permission to go public in the U.S. raised concerns among U.S. officials about what data it could share with the Chinese government.
That relationship helped to spark a proposed U.S. ban on TikTok. Legislation that Congress passed last month aims to force the platform to sell its U.S. assets by Jan. 19 or cease all activity in the country.
ByteDance and several creators on the platform have filed lawsuits to block the bill.
While Shein does not have access to the magnitude of data that a social media giant like TikTok has, the proposed ban has raised more doubts about a U.S. IPO for the company.
""[Congress] just showed us that if a particular Chinese-owned company is perceived to be posing a threat, they can unify and pass a law, and that's much stronger than an executive order or presidential order,"" said Antonia Tzinova, a national security attorney at Holland & Knight.
The political scrutiny beyond data privacy may prove more difficult for Shein to overcome.
The retailer has long been criticized for its alleged use of forced labor in its supply chain and poor working conditions for its employees.
In 2021, the United States passed the Uyghur Forced Labor Prevention Act, which prohibits companies that manufacture goods in the Xinjiang region of China notorious for its Uyghur detention camps from selling in the U.S. Although U.S. government agencies claim Shein's supply chain has links to the Xinjiang region, the company doesn't manufacture its own goods and instead uses China-based micro-manufacturers that make materials tougher to track.
Shein has repeatedly denied the forced-labor allegations, saying it implements a system to support compliance with the U.S. law within the company.
The company has also come under fire for its use of U.S. customs law loopholes.
Because the company doesn't import its products in bulk to sell from a U.S. warehouse and instead ships on an order-by-order basis, it's exempt from some of the heaviest U.S. import taxes. Rivals have criticized this practice as giving Shein an unfair competitive advantage.
— CNBC's Gabrielle Fonrouge and Reuters contributed to this report.



"
China talks up support for IPOs. Investors are watching the speed of approval,https://www.cnbc.com/2024/06/21/china-talks-up-support-for-ipos-investors-are-watching-the-speed-of-approval.html,https://image.cnbcfm.com/api/v1/image/106668476-15977683532020-08-18t094644z_966918122_rc29gi95b8sg_rtrmadp_0_usa-spac-wallstreet.jpeg?v=1664533041&w=410&h=212&vtcrop=y,1 week ago - CNBC News,2024-06-21,"BEIJING — Chinese authorities this week announced new policy for supporting venture capital, raising hopes for faster approvals of initial public offerings in the near future.
A once-burgeoning ecosystem of investment capital and startups in China has slowed drastically in the last three years amid increased regulatory scrutiny.
In one of the latest efforts to shore up the industry, China's top executive body, the State Council, late on Wednesday published high-level measures for ""promoting the high-quality development of venture capital.""
""Everything is going to depend on the implementing regulations,"" said Marcia Ellis, global co-chair of private equity practice at Morrison Foerster.
""It's positive the government at the central level has realized there is a problem,"" Ellis said. ""At least with respect to investments in technology, venture capital can be a positive force in the market in China that frankly can help China compete with the U.S. in the tech race.""
In terms of actions to watch, Ellis said that ""really what we're looking for as far as IPOs, is if the approvals start coming out at a quicker pace.""
""Venture capital investors are not going to make investments unless they can see a reasonably clear path to an exit,"" she said, noting that has not been case for the past year or so.
The new policy included a section on expanding exit channels for venture capital, with an emphasis on supporting companies with technological breakthroughs. The measures also called for implementing a management system for overseas listings and smoothing the exit channels for venture capital funds not denominated in yuan.
""The real bottleneck for overseas listings is the overseas IPO process and foreign exchange rules,"" said Winston Ma, adjunct professor at NYU School of Law.
The pace of both onshore and overseas public offerings has slowed. Investors, especially those who put U.S. dollars into China-based venture capital funds, have preferred IPOs in the U.S. as the largest and most liquid market.
Looking ahead, ""the market is watching the speed of U.S. IPO approvals,"" Ming Liao, founding partner of Prospect Avenue Capital, said in Chinese translated by CNBC.
Chinese authorities tightened their scrutiny and introduced new rules for overseas IPOs after ride-hailing company Didi went ahead with a U.S. listing in 2021 despite reportedly being under government investigation. Separately, the U.S. has increased its scrutiny of U.S. capital going into China, especially military-related entities.
Previously, lack of regulation also resulted in a number of high-profile cases of fraud involving China-based IPOs in the U.S.
Morrison Foerster's Ellis cautioned how the new policy encouraged businesses and research institutions broadly to participate in venture capital.
""Unfortunately I think if companies that are not professional investors start doing this and are doing this because they are encouraged by the government, it may just be more damaging to the market in the long run because they're going to lose money and it's going to stain the venture capital market in China,"" Ellis said. ""You need professionals doing this.""
The China Securities Regulatory Commission has increased fines for misleading investors and clarified requirements for overseas IPOs. Last year it announced updated rules, effective March 31, 2023, that said domestic companies need to comply with national security measures and the personal data protection law before going public overseas.
Since then, 73 companies have listed in the U.S. and 85 in Hong Kong, Fang Xinghai, vice chair of the commission, said during a conference Wednesday, according to state media.
The IPO processing speed hasn't been fast enough and will be accelerated, Fang said in the report, adding the commission supports mainland Chinese companies to list overseas, especially in Hong Kong.
Fast-fashion giant Shein, which has tried to distance itself from its Chinese roots, has reportedly shifted its plans for a U.S. listing to one in London amid regulatory scrutiny.
China has also sought to develop its domestic stock markets, which are only about 30 years old.
Morgan Stanley equity analysts noted separate comments Wednesday from Wu Qing, head of China's securities regulator, that capital markets should increase their targeted support for businesses in line with the country's efforts to develop new technologies.
""We think it implies capital markets could welcome more diverse IPO candidates as long as they can demonstrate innovation and drive productivity growth, although IPO volume might remain low near term given higher standards are also in place,"" the Morgan Stanley report said.
Wu took over as CSRC head in February after a volatile downturn in mainland stocks. Markets have since recouped losses for the year so far.
The new policy also called for supporting international investment institutions to establish yuan-denominated funds.
""If foreign funds were able to set up RMB funds more easily, then there is money that wants to do that,"" Ellis said.
""There are a lot of China-focused funds that are headquartered in Asia,"" she said. ""They are USD funds but their management companies also want to manage onshore RMB funds because they feel like they can actually raise money in China for China investments, whereas raising USD from the U.S. and potentially Europe for China-focused funds is now very difficult."""
Shares of fast-food chain Guzman y Gomez soar as much as 39% on trading debut ,https://www.cnbc.com/2024/06/20/guzman-y-gomez-shares-soar-more-than-39percent-on-trading-debut.html,https://image.cnbcfm.com/api/v1/image/107430930-1718852758593-gettyimages-2157403945-l1210871.jpeg?v=1718852777&w=410&h=212&vtcrop=y,1 week ago - CNBC News,2024-06-20,"Mexican-themed fast-food chain Guzman y Gomez made a stellar debut on the Australian Stock Exchange on Thursday, with its shares soaring as much as 39.1%.
The company, which was valued at 2.23 billion Australian dollars ($1.49 billion) based on its initial public offering price of AU$22 per share, saw shares rise to as high as AU$30.28 on debut.
Shares of Guzman ended its first day of trading at AU$30, up 36.36%.
Guzman y Gomez, which first announced its IPO on May 31 with an offer size of 11.1 million shares, upsized it to 15.3 million shares, raising AU$335.1 million. The company said it had received a commitment from funds advised by Capital Research Global Investors for subscribing its shares.
The company operates more than 200 restaurants in Australia, Singapore, Japan, and the United States, according to its website.
Guzman y Gomez's IPO is Australia's largest since chemical distributor Redox's offering in July 2023 and the fourth offering above $100 million in the past two years, according to Bloomberg.
Barrenjoey and Morgan Stanley were the joint bookrunners for Guzman y Gomez's IPO."
Luxury sneaker maker Golden Goose postpones IPO citing political turmoil in Europe,https://www.cnbc.com/2024/06/19/golden-goose-postpones-milan-ipo-citing-political-turmoil-in-europe.html,https://image.cnbcfm.com/api/v1/image/107430818-1718776779614-gettyimages-1820747787-UK_GOLDEN_GOOSE.jpeg?v=1718776789&w=410&h=212&vtcrop=y,1 week ago - CNBC News,2024-06-19,"Italian sportswear brand Golden Goose postponed its Milan IPO on the grounds that the European Parliament elections and the call for a snap election in France have led to ""significant deterioration"" in market conditions.
Golden Goose, known for its worn-looking trainers which have been made popular by celebrities such as Taylor Swift, was aiming for a market capitalization of up to 1.86 billion euros ($2 billion).
The ""current market backdrop is not the right environment to take the company public,"" the firm said in a Tuesday statement, adding that an IPO will be reassessed in due course.
The European Parliament elections and the calling of a general election in France impacted not only markets in Europe but the luxury sector in particular, Golden Goose said.
It stressed that the brand's IPO process had been ""engaged widely"" with investors. The first day of trading was due to take place on Friday.
France's far-right National Rally (RN) party won around 31% of the vote in the recent European Parliament elections, prompting French President Emmanuel Macron to call a snap national election.
The record gains for the RN party sparked nationwide protests in France as demonstrators pushed back against rising nationalist sentiment. The French CAC 40 lost more than 6.2% last week to record its worst weekly loss since March 2022.
Golden Goose, which is owned by private equity firm Permira, announced last week that Invesco had committed 100 million euros to the listing as a cornerstone backer.
- CNBC's Ganesh Rao contributed to this report."
Retail investors may be a step closer to investing in unicorns,https://www.cnbc.com/2024/06/08/retail-investors-may-be-a-step-closer-to-investing-in-unicorns.html,https://image.cnbcfm.com/api/v1/image/107389130-1710809108765-gettyimages-1815431237-WORLD-NEWS-SKOREA-SATELLITE-OS.jpeg?v=1717782054&w=410&h=212&vtcrop=y,2 weeks ago - CNBC News,2024-06-08,"In this article
An alternative trading platform CEO wants to revolutionize private equity investing to help mitigate a stalling initial public offering market.
So, Forge Global's Kelly Rodriques partnered with Accuidity to launch the Forge Accuidity Private Market Index this spring.
The ultimate goal: Give more investors easier access to unicorns.
""This is a major financial innovation that's just happening now,"" Rodriques told CNBC's ""ETF Edge"" this week. ""There is a future … where index products and other financial innovations are making it possible for every investor to participate.""
The Forge Accuidity Private Market Index consists of 60 private companies including SpaceX, Stripe and Epic Games, according to Forge Global's website. But as of right now, access is still closed off to everyday investors. 
""Today, the regulations are such that you need to have a minimum net worth to meet the threshold of being accredited,"" Rodriques said. 
That means even with Forge's new initiative, only institutional investors and individuals with a high net worth can purchase shares. But anyone, accredited or not, can sell their shares of private companies on the platform. However, those same companies still have a right to refuse transactions on the platform.  
Rodriques hopes as interest in private investing increases, those regulations will shift. 
""We see a world very soon, where nonaccredited investors can come into a basket of index stocks and make a bet across 60 to 70 names, thematics, the same way you do in the public market, and that will really open it up,"" he said.
Disclaimer"
