Title,Link,Image,Source,Time,Article content
Retail investors may be a step closer to investing in unicorns,https://www.cnbc.com/2024/06/08/retail-investors-may-be-a-step-closer-to-investing-in-unicorns.html,https://image.cnbcfm.com/api/v1/image/107389130-1710809108765-gettyimages-1815431237-WORLD-NEWS-SKOREA-SATELLITE-OS.jpeg?v=1717782054&w=410&h=212&vtcrop=y,2 months ago - CNBC News,2024-06-08,"In this article
An alternative trading platform CEO wants to revolutionize private equity investing to help mitigate a stalling initial public offering market.
So, Forge Global's Kelly Rodriques partnered with Accuidity to launch the Forge Accuidity Private Market Index this spring.
The ultimate goal: Give more investors easier access to unicorns.
""This is a major financial innovation that's just happening now,"" Rodriques told CNBC's ""ETF Edge"" this week. ""There is a future … where index products and other financial innovations are making it possible for every investor to participate.""
The Forge Accuidity Private Market Index consists of 60 private companies including SpaceX, Stripe and Epic Games, according to Forge Global's website. But as of right now, access is still closed off to everyday investors. 
""Today, the regulations are such that you need to have a minimum net worth to meet the threshold of being accredited,"" Rodriques said. 
That means even with Forge's new initiative, only institutional investors and individuals with a high net worth can purchase shares. But anyone, accredited or not, can sell their shares of private companies on the platform. However, those same companies still have a right to refuse transactions on the platform.  
Rodriques hopes as interest in private investing increases, those regulations will shift. 
""We see a world very soon, where nonaccredited investors can come into a basket of index stocks and make a bet across 60 to 70 names, thematics, the same way you do in the public market, and that will really open it up,"" he said.
Disclaimer"
Healthcare software firm Waystar raises $968 million in IPO ,https://www.cnbc.com/2024/06/06/healthcare-software-firm-waystar-raises-968-million-in-ipo-.html,https://image.cnbcfm.com/api/v1/image/107381117-1709309019431-gettyimages-2050750214-_s1_0157_y7jyzton.jpeg?v=1717714465&w=410&h=212&vtcrop=y,2 months ago - CNBC News,2024-06-06,"Waystar, a private equity-owned provider of software that helps hospitals and doctors' practices manage their finances, has raised $968 million in its initial public offering, the company said on Thursday.
The IPO of 45 million shares was priced at $21.50 a share, Waystar said. The pricing, which was in the middle of its indicated range, gives Waystar a fully diluted valuation of $3.69 billion.
Reuters reported the pricing earlier based on sources.
The progress in Waystar's IPO shows the market for new listings remains open after aluminum recycler Novelis pulled its stock market debut that would have raised as much as $945 million earlier this week.
Novelis blamed ""adverse market conditions,"" but sources close to the IPO effort said its owner, India's Hindalco Industries, could have gone ahead.
Companies have raised more than $15 billion this year via IPOs on U.S. exchanges, according to Dealogic, up sharply from about $9.1 billion at this point last year, the data show.
Waystar's major shareholders are buyout firm EQT, the Canada Pension Plan Investment Board and alternative investment firm Bain Capital. Following the IPO, EQT, CPPIB, and Bain will own about 29.2%, 22.3%, and 16.8% respectively.
Waystar was formed in 2017 through the merger of Navicure and ZirMed. The company develops payment software helping clients such as large hospital systems with the collection of bills from patients.
It reported a net loss of $51.3 million on revenue of $791 million for 2023, compared to a net loss of $51.5 million on revenue of $705 million in the previous year.
The company was valued at $2.7 billion in 2019 when Swedish private equity firm EQT and CPPIB acquired a majority stake in the company from Bain Capital.
Under EQT and Canadian pension giant CPPIB's ownership, Waystar has gained scale by acquiring some of its competitors, including eSolutions in 2020, which boosted its presence in the lucrative government health insurance market for the elderly, known as Medicare.
The company now works with 1 million healthcare providers and handles more than 2.5 billion transactions annually, according to its website.
Waystar will list on the Nasdaq Global Select Market under the symbol ""WAY"", with its shares expected to start trading on Friday.
JPMorgan Chase & Co, Goldman Sachs Group and Barclays are the lead underwriters for the IPO."
