Title,Link,Image,Source,Time,Article content
"U.S. law firm Dechert weighs shuttering offices in Hong Kong, Beijing: Reuters",https://www.cnbc.com/2024/07/01/dechert-weighs-shuttering-offices-in-hong-kong-beijing-reuters.html,https://image.cnbcfm.com/api/v1/image/107173586-1672816947887-gettyimages-1243950317-yuen-hongkong221013_npffG.jpeg?v=1719800202&w=410&h=212&vtcrop=y,1 month ago - CNBC News,2024-06-30,"U.S.-founded law firm Dechert is considering closing its offices in Hong Kong and Beijing, becoming the latest foreign firm to scale back in Greater China, two people said, amid a prolonged capital market downturn and growing Sino-U.S. tensions.
Dechert has more than 20 employees in its Hong Kong office, 14 of whom are lawyers, including four partners, according to its website and one of the people. Its Beijing office houses only three lawyers, as per the website.
There are no other China offices listed on the global law firm's website.
Some of the impacted employees were notified earlier this month about a potential office closure, said the people, who have knowledge of the matter but declined to be identified as they are not authorized to speak to the media.
The firm, which has about 1,000 lawyers globally, has since been in discussions with several employees in Hong Kong and Beijing, in particular lawyers, about a potential relocation to Singapore, said one of the people.
If the move from China is finalized, Dechert's Asia footprint will be limited to Singapore, which has 14 lawyers including six partners.
It was not immediately clear what would be the effective date of closure of the offices, and whether the firm has started notifying its clients about the move.
Dechert representatives in the U.S. did not respond to Reuters requests for comment.
The move comes as a growing number of U.S. and other global law firms have been rethinking or reducing their presence in China amid growing pressures on foreign businesses, economic uncertainties, muted deal activities, and geopolitical tensions.
New government rules on data privacy and cybersecurity were among the reasons cited by Dentons last year when the global law firm ended its combination with China's Dacheng, an 8,000-lawyer firm.
Several other large U.S. law firms have also announced closures of some of their China offices or scaled down their offerings in the world's second-largest economy since last year.
Morrison & Foerster said last week that it is winding down its Beijing office as its lease there ends later this year. It said most of its work in China is already being handled by lawyers in Shanghai, Hong Kong and elsewhere.
Sidley Austin said in May that it will shutter its Shanghai office, relocate staff and consolidate its China operations in Hong Kong and Beijing by September.
Dechert's gross global revenues grew by just 0.4% to $1.294 billion last year, while profits per equity partner sank 1.2% year-on-year at the firm, according to The American Lawyer magazine.
Dechert said in May last year that it was laying off 55 lawyers and 43 business professionals, equivalent to 5% of its global workforce.
Many major law firms went on a hiring spree globally in 2021 and early 2022, capitalizing on a record-breaking boom in corporate deal making.
However, they have leaned on job cuts to adjust to a decline in demand for legal services since last year as rising interest rates, high inflation and recession fears have soured some companies' appetites for deals and other legal work.
In Hong Kong, Dechert earlier this year axed the whole corporate offering team which had about four lawyers including one partner, as a market downturn and sluggish IPOs darken prospects, said one of the people and another person with direct knowledge."
"Tech founders are shunning IPOs after extended market lull, survey finds",https://www.cnbc.com/2024/06/28/tech-founders-are-shunning-ipos-after-extended-market-lull-techstars.html,https://image.cnbcfm.com/api/v1/image/107353630-1704285928831-107353630-1704285865401-gettyimages-1895737802-US_STOCKS.jpg?v=1710533605&w=410&h=212&vtcrop=y,1 month ago - CNBC News,2024-06-28,"Silicon Valley is known for producing tech businesses that start in garages and turn into massive publicly traded companies ubiquitously known across the globe. From Oracle and Microsoft to Google and Facebook, the public markets are responsible for turning ambitious tech founders into billionaires.
But the appeal of the IPO is waning, according to a survey published this week from startup accelerator Techstars. Of the 1,550 entrepreneurs surveyed by Techstars, only 15% said their long-term goal is an IPO. That's down from 16% a year earlier.
Following an extended bull market in high-growth software and internet stocks, the tech IPO market collapsed in 2022 due to soaring inflation and rising interest rates, which pushed investors out of risk, slashed valuations and led many later-stage companies to delay their plans to go public. 
The prior year was a record period for new offerings, with companies including Roblox, Robinhood, Rivian and UiPath hitting the market. There have been scant few notable tech IPOs in the past two and a half years.
""In combination with the lack of confidence that IPOs will bounce back in short order, this year's data further underlines the trend that startups are staying private for longer, and IPOs are out of favor with the vast majority of early-stage entrepreneurs,"" Techstars said in its report.
For 34% of entrepreneurs surveyed, the preference is to get acquired by a publicly traded company, down from 36% last year, while 30% indicated their goal is to remain private or independent, up from 28% in the prior report.
Investment banks have been gearing up for a rebound. 
Colin Stewart, the Global Head of Technology Equity Capital Markets at Morgan Stanley, told CNBC in April that ""the IPO market's back,"" predicting that 10 to 15 tech companies might go public by the end of the year. Stewart cited high priced and well traded IPOs as ""bod[ing] well for the future."" 
Stewart's comments came after Reddit went public in March, becoming the first major social media company to hold an IPO since Pinterest in 2019. Astera Labs, which sells data center connectivity chips to cloud and artificial intelligence infrastructure companies, went public the same week, followed by data-management company Rubrik in April. 
Prior to that, there was a brief jump in activity in September, when chip designer Arm, grocery delivery company Instacart and cloud software vendor Klaviyo debuted. 
However, in comparison to the pre-2022 stretch, it's been mostly quiet for new tech companies on Wall Street. Uncertainty surrounding the presidential election in November is pointing to a dearth of deals for the remainder of the year. 
""We have the upcoming election, which is not helping the market in H2,"" Athena Theodorou, head of software banking in the Europe region at UBS, told CNBC's ""Squawk Box"" on Wednesday. ""We do expect the market to remain muted in H2,"" Theodorou said, though she said that in Europe the IPO market has started to show signs of life. 
WATCH: IPO market is coming back in Europe"
UK human rights group launches campaign to stop Shein's potential London IPO,https://www.cnbc.com/2024/06/27/uk-human-rights-group-launches-campaign-to-stop-sheins-potential-london-ipo.html,https://image.cnbcfm.com/api/v1/image/107432238-1719236945716-gettyimages-2150177788-20090101240429-99-852802.jpeg?v=1719457162&w=410&h=212&vtcrop=y,2 months ago - CNBC News,2024-06-26,"UK-based human rights group Stop Uyghur Genocide has launched a legal campaign to block Shein's potential London listing over concerns about its labor practices, a law firm representing the campaign group said on Wednesday.
Human rights law firm Leigh Day has written to the UK's Financial Conduct Authority to urge the regulator to refuse any attempt by Shein to list on the LSE, it said.
Shein did not immediately respond to a Reuters request for comment, while the FCA declined to comment.
On Tuesday, Amnesty International UK said Shein's potential London initial public offering would be a ""badge of shame"" for the London Stock Exchange because of the fast-fashion firm's ""questionable"" labor and human rights standards.
Shein confidentially filed papers with Britain's markets regulator in June, two sources told Reuters on Monday, kicking off the process for a potential London listing later this year.
The company has previously said it was investing in strengthening governance and compliance across its supply chain.
The FCA has no investigation or enforcement powers relating to alleged breaches of legislation not within its remit, such as the Modern Slavery Act or tax legislation."
Experts say Shein's U.S. IPO is all but dead,https://www.cnbc.com/2024/06/21/shein-us-ipo-is-dead-experts-say.html,https://image.cnbcfm.com/api/v1/image/107413923-1715606369703-gettyimages-2150178097-20090101240429-99-852616.jpeg?v=1715606470&w=410&h=212&vtcrop=y,2 months ago - CNBC News,2024-06-21,"China-founded e-commerce company Shein's hopes of going public in the United States are growing slimmer by the day, according to experts, as rising tensions between Beijing and the U.S. roil business and trade.
The company, last valued at $66 billion, confidentially filed to go public in the U.S. in November. Since then, it has faced resistance as it tries to join the American retail sphere, including through numerous rejected attempts to become a member of the National Retail Federation, the industry's largest trade association, CNBC previously reported.
The e-commerce upstart filed to go public while becoming a household name in the U.S. by offering low prices and a facility to offer new styles quickly. The company is poised to take major market share from U.S. retailers, particularly Gap, TJX Companies and Macy's, according to UBS data from last year, and continues to challenge Target, Walmart and Amazon.
But as political resistance to its U.S. IPO mounts, Shein is seemingly shifting gears, as it reportedly prepares to confidentially file for a £50 billion offering in London in the coming weeks. The company likely would have preferred to list in the U.S., because the offering could bring a higher valuation than in the U.K., said Angelo Bochanis, an IPO analyst at Renaissance Capital, which provides pre-IPO research and IPO-focused ETFs. 
But its path hasn't been easy, as federal and state officials call on the Securities and Exchange Commission to scrutinize or even block the initial public offering in the U.S.
""Scrutinizing companies with high-profiles and roots in China is very politically in-vogue right now in the United States,"" Bochanis said.
A London IPO could, in theory, be easier than a U.S. offering, according to Bochanis. With the British parliament dissolved and the London Stock Exchange ""desperate for big wins"" as it suffers an IPO drought, Shein could circumvent some of the hurdles that it might have otherwise faced, he said.
If Shein's London IPO succeeds, it is unlikely to keep pursuing a U.S. offering, said University of Florida finance professor Jay Ritter, who studies IPOs.
Not all China-linked companies are getting tangled in the webs of rising political tensions. Chinese electric vehicle company Zeekr went public in the U.S. last month. It became one of the first prominent Chinese companies to do so in the U.S. even as the Biden administration has increasingly cracked down on Chinese-made electric vehicles.
Shein is ""one of the few"" China-tied companies that have gained deep brand awareness with U.S. consumers, Bochanis said.
The size of the potential offering, and the long, high-profile process accompanying it, have helped to make Shein an attractive target for politicians from both parties who want to look tough on Beijing-linked companies.
Shein was founded in China and has since moved its headquarters to Singapore. But a good chunk of the company's supply chain is still based in the country.
In December, the House Committee on Energy and Commerce sent a letter to Shein seeking information about the company's user data collection and its relationship to the Chinese government, calling a potential link to Beijing a ""serious risk for e-commerce, consumer safety and people's data privacy and security.""
The panel sent a similar letter to TikTok, the popular social media platform owned by China-based parent ByteDance.
The Chinese Communist Party can by law request any Chinese-owned company to share information on its customers, according to George Washington University professor Susan Ariel Aaronson. While Shein is headquartered offshore, its manufacturing ties in China and reports that it sought Beijing's permission to go public in the U.S. raised concerns among U.S. officials about what data it could share with the Chinese government.
That relationship helped to spark a proposed U.S. ban on TikTok. Legislation that Congress passed last month aims to force the platform to sell its U.S. assets by Jan. 19 or cease all activity in the country.
ByteDance and several creators on the platform have filed lawsuits to block the bill.
While Shein does not have access to the magnitude of data that a social media giant like TikTok has, the proposed ban has raised more doubts about a U.S. IPO for the company.
""[Congress] just showed us that if a particular Chinese-owned company is perceived to be posing a threat, they can unify and pass a law, and that's much stronger than an executive order or presidential order,"" said Antonia Tzinova, a national security attorney at Holland & Knight.
The political scrutiny beyond data privacy may prove more difficult for Shein to overcome.
The retailer has long been criticized for its alleged use of forced labor in its supply chain and poor working conditions for its employees.
In 2021, the United States passed the Uyghur Forced Labor Prevention Act, which prohibits companies that manufacture goods in the Xinjiang region of China notorious for its Uyghur detention camps from selling in the U.S. Although U.S. government agencies claim Shein's supply chain has links to the Xinjiang region, the company doesn't manufacture its own goods and instead uses China-based micro-manufacturers that make materials tougher to track.
Shein has repeatedly denied the forced-labor allegations, saying it implements a system to support compliance with the U.S. law within the company.
The company has also come under fire for its use of U.S. customs law loopholes.
Because the company doesn't import its products in bulk to sell from a U.S. warehouse and instead ships on an order-by-order basis, it's exempt from some of the heaviest U.S. import taxes. Rivals have criticized this practice as giving Shein an unfair competitive advantage.
— CNBC's Gabrielle Fonrouge and Reuters contributed to this report."
China talks up support for IPOs. Investors are watching the speed of approval,https://www.cnbc.com/2024/06/21/china-talks-up-support-for-ipos-investors-are-watching-the-speed-of-approval.html,https://image.cnbcfm.com/api/v1/image/106668476-15977683532020-08-18t094644z_966918122_rc29gi95b8sg_rtrmadp_0_usa-spac-wallstreet.jpeg?v=1664533041&w=410&h=212&vtcrop=y,2 months ago - CNBC News,2024-06-21,"BEIJING — Chinese authorities this week announced new policy for supporting venture capital, raising hopes for faster approvals of initial public offerings in the near future.
A once-burgeoning ecosystem of investment capital and startups in China has slowed drastically in the last three years amid increased regulatory scrutiny.
In one of the latest efforts to shore up the industry, China's top executive body, the State Council, late on Wednesday published high-level measures for ""promoting the high-quality development of venture capital.""
""Everything is going to depend on the implementing regulations,"" said Marcia Ellis, global co-chair of private equity practice at Morrison Foerster.
""It's positive the government at the central level has realized there is a problem,"" Ellis said. ""At least with respect to investments in technology, venture capital can be a positive force in the market in China that frankly can help China compete with the U.S. in the tech race.""
In terms of actions to watch, Ellis said that ""really what we're looking for as far as IPOs, is if the approvals start coming out at a quicker pace.""
""Venture capital investors are not going to make investments unless they can see a reasonably clear path to an exit,"" she said, noting that has not been case for the past year or so.
The new policy included a section on expanding exit channels for venture capital, with an emphasis on supporting companies with technological breakthroughs. The measures also called for implementing a management system for overseas listings and smoothing the exit channels for venture capital funds not denominated in yuan.
""The real bottleneck for overseas listings is the overseas IPO process and foreign exchange rules,"" said Winston Ma, adjunct professor at NYU School of Law.
The pace of both onshore and overseas public offerings has slowed. Investors, especially those who put U.S. dollars into China-based venture capital funds, have preferred IPOs in the U.S. as the largest and most liquid market.
Looking ahead, ""the market is watching the speed of U.S. IPO approvals,"" Ming Liao, founding partner of Prospect Avenue Capital, said in Chinese translated by CNBC.
Chinese authorities tightened their scrutiny and introduced new rules for overseas IPOs after ride-hailing company Didi went ahead with a U.S. listing in 2021 despite reportedly being under government investigation. Separately, the U.S. has increased its scrutiny of U.S. capital going into China, especially military-related entities.
Previously, lack of regulation also resulted in a number of high-profile cases of fraud involving China-based IPOs in the U.S.
Morrison Foerster's Ellis cautioned how the new policy encouraged businesses and research institutions broadly to participate in venture capital.
""Unfortunately I think if companies that are not professional investors start doing this and are doing this because they are encouraged by the government, it may just be more damaging to the market in the long run because they're going to lose money and it's going to stain the venture capital market in China,"" Ellis said. ""You need professionals doing this.""
The China Securities Regulatory Commission has increased fines for misleading investors and clarified requirements for overseas IPOs. Last year it announced updated rules, effective March 31, 2023, that said domestic companies need to comply with national security measures and the personal data protection law before going public overseas.
Since then, 73 companies have listed in the U.S. and 85 in Hong Kong, Fang Xinghai, vice chair of the commission, said during a conference Wednesday, according to state media.
The IPO processing speed hasn't been fast enough and will be accelerated, Fang said in the report, adding the commission supports mainland Chinese companies to list overseas, especially in Hong Kong.
Fast-fashion giant Shein, which has tried to distance itself from its Chinese roots, has reportedly shifted its plans for a U.S. listing to one in London amid regulatory scrutiny.
China has also sought to develop its domestic stock markets, which are only about 30 years old.
Morgan Stanley equity analysts noted separate comments Wednesday from Wu Qing, head of China's securities regulator, that capital markets should increase their targeted support for businesses in line with the country's efforts to develop new technologies.
""We think it implies capital markets could welcome more diverse IPO candidates as long as they can demonstrate innovation and drive productivity growth, although IPO volume might remain low near term given higher standards are also in place,"" the Morgan Stanley report said.
Wu took over as CSRC head in February after a volatile downturn in mainland stocks. Markets have since recouped losses for the year so far.
The new policy also called for supporting international investment institutions to establish yuan-denominated funds.
""If foreign funds were able to set up RMB funds more easily, then there is money that wants to do that,"" Ellis said.
""There are a lot of China-focused funds that are headquartered in Asia,"" she said. ""They are USD funds but their management companies also want to manage onshore RMB funds because they feel like they can actually raise money in China for China investments, whereas raising USD from the U.S. and potentially Europe for China-focused funds is now very difficult."""
Shares of fast-food chain Guzman y Gomez soar as much as 39% on trading debut ,https://www.cnbc.com/2024/06/20/guzman-y-gomez-shares-soar-more-than-39percent-on-trading-debut.html,https://image.cnbcfm.com/api/v1/image/107430930-1718852758593-gettyimages-2157403945-l1210871.jpeg?v=1718852777&w=410&h=212&vtcrop=y,2 months ago - CNBC News,2024-06-20,"Mexican-themed fast-food chain Guzman y Gomez made a stellar debut on the Australian Stock Exchange on Thursday, with its shares soaring as much as 39.1%.
The company, which was valued at 2.23 billion Australian dollars ($1.49 billion) based on its initial public offering price of AU$22 per share, saw shares rise to as high as AU$30.28 on debut.
Shares of Guzman ended its first day of trading at AU$30, up 36.36%.
Guzman y Gomez, which first announced its IPO on May 31 with an offer size of 11.1 million shares, upsized it to 15.3 million shares, raising AU$335.1 million. The company said it had received a commitment from funds advised by Capital Research Global Investors for subscribing its shares.
The company operates more than 200 restaurants in Australia, Singapore, Japan, and the United States, according to its website.
Guzman y Gomez's IPO is Australia's largest since chemical distributor Redox's offering in July 2023 and the fourth offering above $100 million in the past two years, according to Bloomberg.
Barrenjoey and Morgan Stanley were the joint bookrunners for Guzman y Gomez's IPO."
Computing firm Raspberry Pi pops 38% in rare London market debut,https://www.cnbc.com/2024/06/11/rasperry-pi-ipo-computing-firm-to-raise-211-million.html,https://image.cnbcfm.com/api/v1/image/107221049-1680709415419-gettyimages-518513764-BPS01_Raspberry_Pi_OC_9.jpeg?v=1715769591&w=410&h=212&vtcrop=y,2 months ago - CNBC News,2024-06-11,"Shares of Raspberry Pi surged Tuesday, rallying by more than 38%, as the British computing startup sought to raise some £166 million ($211.2 million) from its initial public offering.
Shares of Raspberry Pi begun ""conditional dealing"" on Tuesday with a full open trade due to begin on Friday. Shares rose to 388 pence by the close after the firm, which makes tiny single-board computers, priced its shares at 280 pence apiece. The listing is seen as a rare win for London's main stock exchange which has struggled to attract technology listings.
Based on the initial pricing of its shares, the company was valued at around £541.6 million.
The Raspberry Pi offering comprises 45.9 million ordinary shares sold by the company's existing majority shareholder, Raspberry Pi Mid Co Limited, a wholly owned subsidiary of the Raspberry Pi Foundation. It also includes 2.13 million ordinary shares sold by other shareholders, along with 11.23 million freshly issued shares.
If there is more demand, a so-called overallotement option will allow the Raspberry Pi Foundation to issue another 4.6 million shares. If the overallotment option is exercised, the final offer size will be  £178.9 million.
Raspberry CEO Eben Upton established the company in 2012 to make computing more accessible to young people. Its single board computers can be used to power a whole range of uses.
While it initially gained traction with hobbyists, the company says that 72% of its unit sales target the industrial market, where it is used, for example, in factories.
In 2023, Raspberry Pi posted revenues of $265.8 million, up 41% year-on-year from 2022.
A number of high-profile industry staples back the company, including Arm and Sony. Last year, Sony Semiconductor Solutions, a subsidiary of Sony Corporation, invested an undisclosed amount in the British startup.
While small relative to other tech firms, the Raspberry Pi IPO could breathe life into the struggling London bourse, which has been snubbed by technology firms in favor or listings in other parts of Europe, and particularly in the U.S.
Softbank-owned chip designer Arm, which is headquartered in the U.K., chose to list in the U.S last year."
