Title,Time,Source,Description,Tickers,Image URL
Therapy developer Alumis prices U.S. IPO at about $902 mln valuation,2024-06-28 00:43:00,3 hours ago - Reuters,"Alumis set the pricing of its U.S. initial public offering at $16 per share, the lower end of its price range, valuing it at around $902 million.",ALMS,https://cdn.snapi.dev/images/v1/h/o/biotech7-2501269.jpg
"Post IPO, WEBTOON Executives Talk Future Plans And Market Trends",2024-06-27 17:37:00,10 hours ago - Forbes,"WEBTOON Entertainment, the company has been changing the way the world reads comics while building a pipeline for turning popular IP into streaming media, films, animation, games and graphic novels, h...",WBTN,https://cdn.snapi.dev/images/v1/2/2/22wed-2501005.jpg
Webtoon IPO: Stock price will be closely watched today as comics platform debuts on Nasdaq,2024-06-27 11:12:00,16 hours ago - Fast Company,"The latest tech company to go public is Los Angeles-based Webtoon Entertainment, a platform for content creators who make and sell digital comic books and manga. Here's what you need to about Webtoon ...",WBTN,https://cdn.snapi.dev/images/v1/p/u/software18-2500152.jpg
Naver's Comic Platform Webtoon Entertainment Seeks To Raise $315M Through U.S. IPO,2024-06-27 05:17:00,22 hours ago - Deadline,Naver's online comics platform Webtoon Entertainment is seeking to raise as much as $315M through an initial public offering in the U.S.,WBTN,https://cdn.snapi.dev/images/v1/t/a/software44-2499136.jpg
"Tencent-backed Shift Up may price IPO at top end of band, source says",2024-06-26 23:45:00,1 day ago - Reuters,"South Korean gaming company Shift Up is set to price its initial public offering (IPO) at the top end of its price band and raise $313 million, according to a source with direct knowledge of the matte...",TCEHY,https://cdn.snapi.dev/images/v1/2/w/2wedw-2498994.jpg
Tamboran Prices US IPO at US$24.00 Per Share,2024-06-26 19:43:00,1 day ago - Business Wire,NEW YORK--(BUSINESS WIRE)--Tamboran Resources Corporation: Further details A registration statement on Form S-1 relating to the proposed offering was declared effective by the U.S. Securities and Exch...,TBN,https://cdn.snapi.dev/images/v1/p/r/press8-2498886.jpg
Webtoon Entertainment prices US IPO at $21 per share,2024-06-26 19:13:00,1 day ago - Reuters,Online comics platform Webtoon Entertainment said on Wednesday it has priced its initial public offering of 15 million shares at $21 per share.,WBTN,https://cdn.snapi.dev/images/v1/3/3/333erf-2498875.jpg
"Exclusive: Hyundai India IPO banks set for country's 2nd biggest payday with $40 mln fee, sources say",2024-06-26 05:52:00,1 day ago - Reuters,"Banks advising South Korean automaker Hyundai on its India IPO are set to make as much as $40 million in fees, three sources said, a windfall in a market where banks typically struggle to make money g...",HYMTF,https://cdn.snapi.dev/images/v1/2/d/2dews-2496844.jpg
Therapy developer Alumis seeks up to $1 bln valuation in US IPO,2024-06-24 08:27:00,3 days ago - Reuters,"Alumis is targeting a valuation of up to $1.01 billion in its initial public offering in the United States, the therapy developer said on Monday.",ALMS,https://cdn.snapi.dev/images/v1/d/h/biotech5-2492688.jpg
Alumis eyes $300 million in proceeds in IPO,2024-06-24 07:18:00,3 days ago - Market Watch,Biopharmaceutical company Alumis Inc. on Monday said it plans to offer 17.65 million shares at an estimated price range of $16 to $18 a share in its upcoming initial public offering. At the midpoint o...,ALMS,https://cdn.snapi.dev/images/v1/i/p/biotech40-2492471.jpg
Ardent Health Partners files for IPO,2024-06-21 18:40:00,6 days ago - Market Watch,"Hospital operator Ardent Health Partners, which is backed by an investment firm founded by the late real-estate magnate Sam Zell, has filed for a initial public offering, according to regulatory docum...",ARDT,https://cdn.snapi.dev/images/v1/b/1/reit37-2491503.jpg
Viking Holdings IPO: Analyzing Market Enthusiasm and Its Financial Outlook,2024-06-21 09:00:00,6 days ago - GuruFocus,"The initial public offering of Viking Holdings Ltd. (VIK, Financial) was quite successful, raising $1.54 billion at around $24 per share.",VIK,https://cdn.snapi.dev/images/v1/k/d/kdkm2-2489996.jpg
Society Pass Inc. Bolstering Subsidiaries Ahead of IPOs to Drive Growth and Customer Engagement,2024-06-20 10:44:00,7 days ago - GlobeNewsWire,"SINGAPORE, June 20, 2024 (GLOBE NEWSWIRE) -- Society Pass Inc. (NASDAQ: SOPA), Southeast Asia's premier data-driven loyalty, fintech, and e-commerce ecosystem, is gearing up for the upcoming IPOs of i...",SOPA,https://cdn.snapi.dev/images/v1/t/w/press15-2488358.jpg
BlackRock backs IPO from online comics company Webtoon Entertainment,2024-06-18 08:21:00,9 days ago - Market Watch,Webtoon Entertainment Inc. is seeking a market valuation of about $2.5 billion as the online comics unit of South Korea's internet and search company Naver Corp. prepares its initial public offering.,BLK,https://cdn.snapi.dev/images/v1/n/v/asset-management14-2484286.jpg
Breakingviews: Hyundai's India IPO will have imitators,2024-06-17 00:46:00,11 days ago - Reuters,"If Hyundai Motor's up to $3 billion initial public offering of its Indian business crystallises a premium valuation as easily as expected, other multinationals could rush to list their local operation...",HYMTF,https://cdn.snapi.dev/images/v1/f/8/auto5-2481304.jpg
Tempus IPO: Stock price watched today as AI health-tech company starts Nasdaq trading,2024-06-16 07:10:00,11 days ago - Fast Company,Nothing is hotter in tech right now than artificial intelligence. No wonder then that many AI companies see 2024 as the year to go public.,TEM,https://cdn.snapi.dev/images/v1/y/w/medical22-2480976.jpg
Hyundai unit files for India IPO that could be country's biggest,2024-06-14 22:54:00,13 days ago - Reuters,"South Korea's Hyundai Motor is looking to sell a stake of up to 17.5% in the initial public offering of its India unit, draft papers filed with the country's markets regulator showed on Saturday, in w...",HYMTF,https://cdn.snapi.dev/images/v1/n/j/njwdd-2480720.jpg
Tempus AI Surges in Nasdaq Debut Following IPO,2024-06-14 14:35:00,13 days ago - Investopedia,Shares of healthcare technology firm Tempus AI surged Friday as they began trading on the Nasdaq.,TEM,https://cdn.snapi.dev/images/v1/t/q/gettyimages-2147839582-cb0504e-2480456.jpg
Hyundai Motor India plans record-breaking $3 billion IPO,2024-06-14 05:17:00,13 days ago - Invezz,"South Korean auto giant Hyundai Motor Co's Indian arm, Hyundai Motor India Limited, is gearing up to file draft papers with market regulator Sebi to raise around $3 billion via an initial public offer...",HYMTF,https://cdn.snapi.dev/images/v1/h/y/hyundai-january-25-2479524.jpg
FinTech IPO Tracker Loses 3.8% Despite Affirm's Rally on Apple Pay Tie-up,2024-06-14 04:00:00,14 days ago - PYMNTS,"Affirm saw its stock rally 7.8% this past week, but the overall trend for the FinTech IPO Index was down, as the group sank 3.8%.","AAPL, AFRM",https://cdn.snapi.dev/images/v1/f/i/fintech-ipo-0613jpgw457-2479519.jpg
Tempus AI announces pricing of US IPO,2024-06-13 19:01:00,14 days ago - Reuters,SoftBank Group-backed Tempus AI announced on Thursday the pricing of its initial public offering of 11.1 million ordinary shares at a price of $37 apiece.,TEM,https://cdn.snapi.dev/images/v1/n/e/b52su4ek4nktfckjez3zjp4mmy-2479087.jpg
"OpenAI taps veteran of Nextdoor, Square as new CFO, raising speculation about IPO",2024-06-10 19:56:00,17 days ago - Market Watch,"Artificial-intelligence developer OpenAI said Monday that Sarah Friar would become its next chief financial officer, as it prepares to work more closely with a growing number of large companies and de...",MSFT,https://cdn.snapi.dev/images/v1/g/g/im-90843115size177777777777777-2472477.jpg
Walgreens Looks For Boots Buyers Again As IPO Plans Put On Ice,2024-06-10 08:45:00,17 days ago - Forbes,Walgreens Boots Alliance Inc. is understood to have ditched plans for a potential initial public offering (IPO) of its U.K. drugstore giant Boots.,WBA,https://cdn.snapi.dev/images/v1/o/c/walgreens-looks-for-boots-buye-2471005.jpg
Walmart Says PhonePe and Flipkart IPOs Years Away,2024-06-09 16:52:00,18 days ago - PYMNTS,"Walmart's India-based eCommerce marketplace and payments company aren't quite ready to go public. “This is something we're looking at over the next couple of years,” Walmart's executive vice president...",WMT,https://cdn.snapi.dev/images/v1/w/a/walt15-2470359.jpg
Waystar IPO: Stock price will be closely watched today as the healthcare software company debuts on Nasdaq,2024-06-08 06:21:00,19 days ago - Fast Company,"The name may conjure up memories of HBO's Succession (in which the fictional company at the center of the action is called “Waystar Royco”), but this Waystar is very much real—and it's hitting the pub...",WAY,https://cdn.snapi.dev/images/v1/k/n/p-1-91137657-waystar-ipo-2469647.jpg
"Exclusive: IPOs of Walmart's Flipkart, PhonePe could take couple of years, Walmart exec says",2024-06-07 16:53:00,20 days ago - Reuters,"Initial public offerings of Walmart's Flipkart marketplace and PhonePe digital payments platform could take a couple of years, a Walmart executive said.",WMT,https://cdn.snapi.dev/images/v1/w/a/walt16-2469316.jpg
Waystar shares slip in Nasdaq debut after digital health company priced IPO in middle of range,2024-06-07 14:13:00,20 days ago - CNBC,"Health-care payments company Waystar began trading on the Nasdaq Friday. The stock opened at $21 per share, after the company priced its IPO at $21.50.",WAY,https://cdn.snapi.dev/images/v1/9/2/7imtr-2105711-2469037.jpg
"Walgreens shelves plans for Boots IPO, Bloomberg News reports",2024-06-07 13:36:00,20 days ago - Reuters,"Walgreens Boots Alliance has shelved plans for a potential initial public offering of its UK-based Boots drugstore chain as sale talks continue, Bloomberg News reported on Friday citing people with kn...",WBA,https://cdn.snapi.dev/images/v1/p/r/6xoqxfkawrna7cr6mktjxqetoq-2469510.jpg
Waystar is valued at about $3.7 billion in IPO that raised $967.5 million,2024-06-07 08:21:00,20 days ago - Market Watch,"Waystar Holding Corp., a healthcare-payments software company, said its initial public offering priced at $21.50 a share, the midpoint of its proposed price range.",WAY,https://cdn.snapi.dev/images/v1/i/w/im-06561877size177777777777777-2468112.jpg
J&J-backed Rapport Therapeutics raises $136 mln in US IPO,2024-06-06 19:57:00,21 days ago - Reuters,Rapport Therapeutics said on Thursday that it has raised $136 million in its initial public offering in the United States at a valuation of about $601.4 million.,"JNJ, RAPP",https://cdn.snapi.dev/images/v1/f/5/healthcare1600a-2209534-2467546.jpg
Exclusive: Healthcare software firm Waystar eyes pricing IPO at midpoint of indicated range - sources,2024-06-06 13:54:00,21 days ago - Reuters,"Waystar, a private equity-owned vendor of software that helps hospitals and doctors' practices manage their finances, has secured enough investor commitments to plan pricing its initial public offerin...",WAY,https://cdn.snapi.dev/images/v1/i/o/waystar-457x277-2109237-2467035.jpg
Healthcare-technology company Tempus AI looks to raise $400 million in IPO,2024-06-05 07:44:00,22 days ago - Market Watch,Tempus AI Inc. is about to give investors a way to play the intersection of medicine and artificial intelligence.,TEM,https://cdn.snapi.dev/images/v1/7/a/im-33803165size177777777777777-2463418.jpg
Tempus AI seeks up to $6.1 bln valuation in US IPO,2024-06-05 06:36:00,22 days ago - Reuters,"Tempus AI is targeting a valuation of up to $6.10 billion in its initial public offering in the United States, the genetics testing company said on Wednesday.",TEM,https://cdn.snapi.dev/images/v1/4/a/fdvvhtpvwjdz5jbune6yzpp6we-2463145.png
Novelis Postpones Over $900 Million U.S. IPO,2024-06-04 22:55:00,23 days ago - WSJ,"Hindalco-backed aluminum recycling company Novelis has postponed its U.S. listing of over $900 million, citing market conditions.",NVL,https://cdn.snapi.dev/images/v1/g/q/alu3-2462842.jpg
Proficient Auto Logistics Announces Partial Exercise of IPO Over-Allotment Option,2024-06-04 17:27:00,23 days ago - Business Wire,"JACKSONVILLE, Fla.--(BUSINESS WIRE)--As previously announced, in connection with its initial public offering (“IPO”), Proficient Auto Logistics, Inc. (NASDAQ: PAL) (the “Company”) granted the underwri...",PAL,https://cdn.snapi.dev/images/v1/r/p/press18-2462635.jpg
J&J-backed Rapport Therapeutics seeks about $637 mln valuation in US IPO,2024-06-03 13:14:00,24 days ago - Reuters,"Rapport Therapeutics is targeting a valuation of about $637 million in its initial public offering in the United States, as the biopharmaceutical company joins a slew of firms looking to list their sh...","JNJ, RAPP",https://cdn.snapi.dev/images/v1/k/u/drugs3-2459723.jpg
WallachBeth Announces Closing of KindlyMD's $6.8m IPO,2024-06-03 11:45:00,24 days ago - PRNewsWire,"JERSEY CITY, N.J. , June 3, 2024 /PRNewswire/ -- WallachBeth Capital LLC, a leading provider of capital markets and institutional execution services, announced today that KindlyMD, Inc. (NASDAQ: KDLY;...",KDLY,https://cdn.snapi.dev/images/v1/j/r/press19-2459515.jpg
WallachBeth Capital Announces Pricing of KindlyMD's $6.8 Million IPO,2024-05-31 13:15:00,27 days ago - PRNewsWire,"JERSEY CITY, N.J. , May 31, 2024 /PRNewswire/ -- KindlyMD, Inc. (NASDAQ: KDLY; KDLYW) (""KindlyMD"" or the ""Company""), a patient-first healthcare and healthcare data company uniquely integrating traditi...",KDLY,https://cdn.snapi.dev/images/v1/b/5/press18-2456803.jpg
FinTech IPO Index Gains 1.2% as MoneyLion and Sezzle Surge,2024-05-31 04:00:00,4 weeks ago - PYMNTS,"Earnings dragged down several names in the FinTech IPO Index, but the overall performance was positive, up 1.2%. A few double-digit gainers led the way.",ML,https://cdn.snapi.dev/images/v1/f/i/fintech-ipo-0530jpgw457-2455819.jpg
Billionaire Groupon founder Lefkofsky is back with another IPO: AI healthtech Tempus,2024-05-30 17:34:00,4 weeks ago - TechCrunch,"Eric Lefkofsky knows the public listing rodeo well and is about to enter it for a fourth time. The serial entrepreneur, whose net worth is estimated at nearly $4 billion, has already taken three busin...",TEM,https://cdn.snapi.dev/images/v1/l/q/eric-lefkofsky-1jpgresize12008-2455188.jpg
Healthcare Payments Software Provider Waystar Launches IPO as Market Improves,2024-05-28 15:06:00,4 weeks ago - PYMNTS,Healthcare payments software provider Waystar launched its initial public offering (IPO). The company applied to list its shares on Nasdaq under the symbol “WAY” and said the estimated IPO price is be...,WAY,https://cdn.snapi.dev/images/v1/u/z/waystar-ipo-healthcare-payment-2450463.jpg
"Waystar Holding Announces IPO, Plans To Raise About $1 Billion",2024-05-28 10:20:00,4 weeks ago - Investopedia,Healthcare payments software provider Waystar Holding on Tuesday announced plans to raise about $1 billion in an initial public offering (IPO).,WAY,https://cdn.snapi.dev/images/v1/y/d/gettyimages-2107846207-1944e36-2450025.jpg
Hindaclo-backed aluminum recycler Novelis to raise about $877 million in IPO,2024-05-28 07:39:00,4 weeks ago - Market Watch,Aluminum-recycling company Novelis Inc. said Tuesday it plans to offer 45 million shares at an estimate price range of $18 to $21 a share in its upcoming initial public offering. At the midpoint of th...,NVL,https://cdn.snapi.dev/images/v1/y/k/alu2-2449561.jpg
Novelis targets up to $12.6 bln valuation in US IPO,2024-05-28 07:26:00,4 weeks ago - Reuters,"Novelis, owned by Indian billionaire Kumar Mangalam Birla's Hindalco Industries , is targeting a valuation of up to $12.6 billion in its initial public offering in the United States, the aluminum prod...",NVL,https://cdn.snapi.dev/images/v1/3/p/2cs2exsdfvk7bbexwg64msqz6m-2449516.jpg
Private equity-backed Waystar seeks to raise about $1 billion in IPO,2024-05-28 06:51:00,4 weeks ago - Market Watch,"Waystar Holding Corp., a healthcare payments software company, on Tuesday said it plans to offer 45 million shares at an estimated price range of $20 to $23 a share in its upcoming initial public offe...",WAY,https://cdn.snapi.dev/images/v1/x/s/health3-2449394.jpg
